271a9ce9-c6d3-4b63-a722-cb0adc48863f,dwc:typeStatus,Voucher of Uncisudis advena,1
271a9ce9-c6d3-4b63-a722-cb0adc48863f,typestatus,voucher of emmonsia epidermata| voucher of favosites spiculatus,1
71b8ffab-444e-43f9-9a9c-5c42b0eaa5eb,dwc:preparations,"L I/3, R M/3 TALONID, + ASSOCIATED TOOTH FRAGS",1
271a9ce9-c6d3-4b63-a722-cb0adc48863f,typestatus,syntype of unio gladiolus,1
271a9ce9-c6d3-4b63-a722-cb0adc48863f,dwc:typeStatus,Lectotype of Nerita cumingiana,1
271a9ce9-c6d3-4b63-a722-cb0adc48863f,typestatus,paratype of cyrtaphe alternata,1
271a9ce9-c6d3-4b63-a722-cb0adc48863f,dwc:typeStatus,Holotype of Drassyllus louisianus,1
271a9ce9-c6d3-4b63-a722-cb0adc48863f,typestatus,paratype of pomacea zeteki,1
271a9ce9-c6d3-4b63-a722-cb0adc48863f,typestatus,holotype of pristigloma alba,1
271a9ce9-c6d3-4b63-a722-cb0adc48863f,typestatus,paratype of sinocybe cooki,1
271a9ce9-c6d3-4b63-a722-cb0adc48863f,dwc:typeStatus,Paratype of Delavaya dianchiensis,1
271a9ce9-c6d3-4b63-a722-cb0adc48863f,dwc:typeStatus,Paratype of Cryptops floridanus,1
271a9ce9-c6d3-4b63-a722-cb0adc48863f,typestatus,paratype of pseudocyclotus coultasi,1
84c24d87-e4ad-4165-8e86-5ae1a249c196,dwc:preparations,caudal vertebra in matrix,1
84c24d87-e4ad-4165-8e86-5ae1a249c196,dwc:preparations,ramus w/ p2-m3,1
84c24d87-e4ad-4165-8e86-5ae1a249c196,dwc:preparations,osteoscutes (2) and long bone frag.,1
271a9ce9-c6d3-4b63-a722-cb0adc48863f,typestatus,genetic voucher of blenniella chrysospilos,1
271a9ce9-c6d3-4b63-a722-cb0adc48863f,typestatus,syntype of plectreurys bicolor,1
40250f4d-7aa6-4fcc-ac38-2868fa4846bd,dwc:disposition,"DES, NO, OSC, SD",1
