40250f4d-7aa6-4fcc-ac38-2868fa4846bd,dwc:disposition,"HUEFS, MEXU, UTEP",1
271a9ce9-c6d3-4b63-a722-cb0adc48863f,typestatus,holotype of xenospiza baileyi,1
71b8ffab-444e-43f9-9a9c-5c42b0eaa5eb,dwc:preparations,L MAX: M2/,1
71b8ffab-444e-43f9-9a9c-5c42b0eaa5eb,dwc:preparations,"SKELETON, GREATER PART",2
71b8ffab-444e-43f9-9a9c-5c42b0eaa5eb,dwc:preparations,LIMB BONE FRAGMENT,2
271a9ce9-c6d3-4b63-a722-cb0adc48863f,dwc:typeStatus,Additional Material of Leptophis mexicanus yucatanensis| Paratype of Leptophis mexicanus yucatanensis,1
271a9ce9-c6d3-4b63-a722-cb0adc48863f,typestatus,paratype of oonops ebenecus,1
271a9ce9-c6d3-4b63-a722-cb0adc48863f,typestatus,holotype of scaphidium obliteratum,1
271a9ce9-c6d3-4b63-a722-cb0adc48863f,typestatus,holotype of acrocidaris minor,1
271a9ce9-c6d3-4b63-a722-cb0adc48863f,dwc:preparations,skeleton (dry); tissue (ethanol: vapor phase nitrogen); hide (dry); tissue (ethanol: vapor phase nitrogen); tissue (ethanol: vapor phase nitrogen); tissue (95% ethanol) sample,2
137ed4cd-5172-45a5-acdb-8e1de9a64e32,dwc:preparations,thin section w/remnants; thin section; remnant,2
271a9ce9-c6d3-4b63-a722-cb0adc48863f,dwc:typeStatus,Holotype of Derobrochus aeternus,1
271a9ce9-c6d3-4b63-a722-cb0adc48863f,dwc:typeStatus,Holotype of Colaspis diluvialis,1
271a9ce9-c6d3-4b63-a722-cb0adc48863f,typestatus,holotype of diploglossus curtissi aporus,1
271a9ce9-c6d3-4b63-a722-cb0adc48863f,typestatus,holotype of anapagurus marginatus,1
db3181c9-48dd-489f-96ab-a5888f5a938c,dwc:preparations,100% prepped - 96,3
271a9ce9-c6d3-4b63-a722-cb0adc48863f,dwc:typeStatus,Lectotype of Cylindrella elatior,1
271a9ce9-c6d3-4b63-a722-cb0adc48863f,typestatus,lectotype of calostylis trigemma| lectotype of zaphrentis trigemma,1
1ba0bbad-28a7-4c50-8992-a028f79d1dc5,dwc:preparations,PREP - 1835,1
271a9ce9-c6d3-4b63-a722-cb0adc48863f,typestatus,syntype of dictyna floridana,1
271a9ce9-c6d3-4b63-a722-cb0adc48863f,dwc:typeStatus,Paratype of Bulla marmorea,1
5ab348ab-439a-4697-925c-d6abe0c09b92,dwc:preparations,max+tooth frags,1
71b8ffab-444e-43f9-9a9c-5c42b0eaa5eb,dwc:preparations,"2 L M/1, 2 R M/1, OTHER TEETH",1
40250f4d-7aa6-4fcc-ac38-2868fa4846bd,dwc:identificationQualifier,appr. I. acradenia,1
5ab348ab-439a-4697-925c-d6abe0c09b92,dwc:preparations,TOOTH+ALVEOLUS,1
5ab348ab-439a-4697-925c-d6abe0c09b92,dwc:preparations,juvenile partial cranium,1
71b8ffab-444e-43f9-9a9c-5c42b0eaa5eb,dwc:preparations,R JAW WITH P/3-DP/4,1
71b8ffab-444e-43f9-9a9c-5c42b0eaa5eb,dwc:preparations,"JAW FRAG, P/4-M/1-M/2 | Cast",1
5ab348ab-439a-4697-925c-d6abe0c09b92,dwc:preparations,ANTLER+SKULL FRAG,1
5ab348ab-439a-4697-925c-d6abe0c09b92,dwc:preparations,VERTEBRA+BONES,1
71b8ffab-444e-43f9-9a9c-5c42b0eaa5eb,dwc:preparations,PARTIAL PREMAX WITH 1 I#/,1
71b8ffab-444e-43f9-9a9c-5c42b0eaa5eb,dwc:preparations,"L JAW, P/1-M/3 | Cast",2
5ab348ab-439a-4697-925c-d6abe0c09b92,dwc:preparations,"SKULL,SCUTES,POSTCRANIALBONES",1
71b8ffab-444e-43f9-9a9c-5c42b0eaa5eb,dwc:preparations,"MANY TOOTH FRAGS, SMALL BONE",1
5ab348ab-439a-4697-925c-d6abe0c09b92,dwc:preparations,juv partal shell,1
71b8ffab-444e-43f9-9a9c-5c42b0eaa5eb,dwc:preparations,5 L & 2 R M/1; 15 MOLARS; 4 INCISORS,1
5ab348ab-439a-4697-925c-d6abe0c09b92,dwc:preparations,L dentary w/ /m2 frag.,1
5ab348ab-439a-4697-925c-d6abe0c09b92,dwc:preparations,FAT,1
271a9ce9-c6d3-4b63-a722-cb0adc48863f,typestatus,paratype of dolichopus bryanti,2
271a9ce9-c6d3-4b63-a722-cb0adc48863f,typestatus,holotype of amphiura cuneata,1
271a9ce9-c6d3-4b63-a722-cb0adc48863f,dwc:typeStatus,Lectotype of Psectrogaster rhomboides,1
271a9ce9-c6d3-4b63-a722-cb0adc48863f,typestatus,holotype of oenomys hypoxanthus talangae,1
271a9ce9-c6d3-4b63-a722-cb0adc48863f,dwc:typeStatus,Voucher of Eucalyptocrinus elrodi,1
271a9ce9-c6d3-4b63-a722-cb0adc48863f,typestatus,voucher of ceraurus milleranus,3
71b8ffab-444e-43f9-9a9c-5c42b0eaa5eb,dwc:preparations,DISASSOCIATED GANOID FIN RAYS,1
271a9ce9-c6d3-4b63-a722-cb0adc48863f,dwc:typeStatus,Paratype of Pauropygus pyramidoides| Paratype of Haimea pyramidoides,1
271a9ce9-c6d3-4b63-a722-cb0adc48863f,dwc:typeStatus,Paratype of Cephalotes flavigaster,2
271a9ce9-c6d3-4b63-a722-cb0adc48863f,dwc:typeStatus,Holotype of Pheidole caldwelli,1
271a9ce9-c6d3-4b63-a722-cb0adc48863f,dwc:typeStatus,Holotype of Xenopus eysoole,1
271a9ce9-c6d3-4b63-a722-cb0adc48863f,typestatus,voucher of tubulanus sexlineatus,1
271a9ce9-c6d3-4b63-a722-cb0adc48863f,dwc:preparations,penis (formalin/70% ethanol),1
271a9ce9-c6d3-4b63-a722-cb0adc48863f,dwc:typeStatus,Syntype of Epitomapta tabogae,1
271a9ce9-c6d3-4b63-a722-cb0adc48863f,dwc:typeStatus,Holotype of Eleutherodactylus cundalli glaucoreius,1
271a9ce9-c6d3-4b63-a722-cb0adc48863f,typestatus,syntype of ophiothrix aristulata,1
271a9ce9-c6d3-4b63-a722-cb0adc48863f,typestatus,holotype of telamonia resplendens,1
271a9ce9-c6d3-4b63-a722-cb0adc48863f,typestatus,plastotype (paleontology) of cypricardia acutifrons,1
271a9ce9-c6d3-4b63-a722-cb0adc48863f,dwc:typeStatus,Paratype of Siphogenerinoides parva,1
271a9ce9-c6d3-4b63-a722-cb0adc48863f,dwc:typeStatus,Holotype of Choristes agulhasensis agulhasensis,1
271a9ce9-c6d3-4b63-a722-cb0adc48863f,dwc:typeStatus,Type of Melania lutosa,1
271a9ce9-c6d3-4b63-a722-cb0adc48863f,typestatus,syntype of tellina (moerella) chrysogona,1
271a9ce9-c6d3-4b63-a722-cb0adc48863f,typestatus,paratype of polygyra laevior,1
271a9ce9-c6d3-4b63-a722-cb0adc48863f,dwc:typeStatus,Lectotype of Helicina solida,1
271a9ce9-c6d3-4b63-a722-cb0adc48863f,dwc:typeStatus,Paratype of Pardosa orthodox,1
271a9ce9-c6d3-4b63-a722-cb0adc48863f,typestatus,paratype of physopsis africana gigas,1
271a9ce9-c6d3-4b63-a722-cb0adc48863f,typestatus,holotype of ethojulus amphelictus,1
271a9ce9-c6d3-4b63-a722-cb0adc48863f,typestatus,paratype of cepedea pulchra,1
271a9ce9-c6d3-4b63-a722-cb0adc48863f,typestatus,syntype of cyclophorus ngankingensis,1
271a9ce9-c6d3-4b63-a722-cb0adc48863f,typestatus,holotype of sphyrotinus reservatus,1
271a9ce9-c6d3-4b63-a722-cb0adc48863f,dwc:typeStatus,Paratype of Achatina achatina rosedabiata,1
271a9ce9-c6d3-4b63-a722-cb0adc48863f,typestatus,voucher of pullenia obliquilobulata,1
271a9ce9-c6d3-4b63-a722-cb0adc48863f,dwc:typeStatus,Genetic Voucher of Peripatoides suteri| Genetic Voucher of Peripatoides novaezealandiae| Voucher of Peripatoides novaezealandiae,1
271a9ce9-c6d3-4b63-a722-cb0adc48863f,typestatus,holotype of pedina sinaica| voucher of pedina sinaica| voucher of pedina sinaica,1
271a9ce9-c6d3-4b63-a722-cb0adc48863f,dwc:typeStatus,Genetic Voucher of Plicatoperipatus jamaicensis| Voucher of Plicatoperipatus jamaicensis,1
271a9ce9-c6d3-4b63-a722-cb0adc48863f,dwc:typeStatus,Holotype of Monticellina acunai,1
271a9ce9-c6d3-4b63-a722-cb0adc48863f,dwc:typeStatus,Paratype of Caelatura rotula,1
271a9ce9-c6d3-4b63-a722-cb0adc48863f,typestatus,paratype of urocoptis rufescens,1
271a9ce9-c6d3-4b63-a722-cb0adc48863f,typestatus,paratype of sonorella santaritana,1
b7a79601-c07b-46d5-bd09-d4472b0d9431,dwc:nomenclaturalCode,sternal,1
5ab348ab-439a-4697-925c-d6abe0c09b92,dwc:preparations,R Metacarp.,1
71b8ffab-444e-43f9-9a9c-5c42b0eaa5eb,dwc:preparations,"SKULL, JAW, CERVICALS",1
71b8ffab-444e-43f9-9a9c-5c42b0eaa5eb,dwc:preparations,"L P/3, L M/1-M/2, R M/2-M/3, FRAGS, ASSOCIATED",1
5ab348ab-439a-4697-925c-d6abe0c09b92,dwc:preparations,"L M1/,PARASTYLE",1
271a9ce9-c6d3-4b63-a722-cb0adc48863f,typestatus,voucher of isorophus cincinnatiensis| voucher of agelacrinites cincinnatiensis,1
271a9ce9-c6d3-4b63-a722-cb0adc48863f,dwc:typeStatus,Paratype of Melitaea trivia var. ignasiti,2
271a9ce9-c6d3-4b63-a722-cb0adc48863f,typestatus,syntype of liancalus querulus| paralectotype of liancalus querulus,1
271a9ce9-c6d3-4b63-a722-cb0adc48863f,typestatus,type of lathrobium ambiguum,1
271a9ce9-c6d3-4b63-a722-cb0adc48863f,typestatus,paratype of microdon banksi,1
271a9ce9-c6d3-4b63-a722-cb0adc48863f,dwc:typeStatus,Paralectotype of Brachyopa notata,2
5ab348ab-439a-4697-925c-d6abe0c09b92,dwc:preparations,L dentary frag. with /m1?,1
5ab348ab-439a-4697-925c-d6abe0c09b92,dwc:preparations,"left dentary and splenial, posterior symphysis",1
5ab348ab-439a-4697-925c-d6abe0c09b92,dwc:preparations,"MAXILLARY,DENTARIES,LIMB BONES",1
71b8ffab-444e-43f9-9a9c-5c42b0eaa5eb,dwc:preparations,"PALATE WITH M1/, M2/; L JAW, 2 R JAWS",1
5ab348ab-439a-4697-925c-d6abe0c09b92,dwc:preparations,xiphoid process,1
271a9ce9-c6d3-4b63-a722-cb0adc48863f,dwc:typeStatus,Holotype of Gephyrina punctata,1
271a9ce9-c6d3-4b63-a722-cb0adc48863f,dwc:typeStatus,Paralectotype of Harpalus montanus,1
271a9ce9-c6d3-4b63-a722-cb0adc48863f,typestatus,figured of gulella nyikaensis,1
271a9ce9-c6d3-4b63-a722-cb0adc48863f,typestatus,syntype of michelinia prima,1
271a9ce9-c6d3-4b63-a722-cb0adc48863f,dwc:typeStatus,Lectotype of Amara harpalina,1
271a9ce9-c6d3-4b63-a722-cb0adc48863f,typestatus,syntype of astrocharis ijimai,1
271a9ce9-c6d3-4b63-a722-cb0adc48863f,dwc:typeStatus,Lectotype of Poecilus subcordatus,1
271a9ce9-c6d3-4b63-a722-cb0adc48863f,dwc:typeStatus,Syntype of Spongia lapidescens Mauritiana var. Pacifica,1
5082e6c8-8f5b-4bf6-a930-e3e6de7bf6fb,typestatus,"holotype of pteromalus longicornis statz, 1938",1
5082e6c8-8f5b-4bf6-a930-e3e6de7bf6fb,typestatus,"holotype of pteromalus hirtipes statz, 1938",1
271a9ce9-c6d3-4b63-a722-cb0adc48863f,typestatus,holotype of amastra subcrassilabris,1
271a9ce9-c6d3-4b63-a722-cb0adc48863f,typestatus,syntype of pirata sylvestris,1
271a9ce9-c6d3-4b63-a722-cb0adc48863f,dwc:typeStatus,Syntype of Cylindrella strangulata,1
271a9ce9-c6d3-4b63-a722-cb0adc48863f,typestatus,syntype of cylindrella strangulata,1
271a9ce9-c6d3-4b63-a722-cb0adc48863f,dwc:typeStatus,Paralectotype of Achatinella (Achatinellastrum) buddii,2
271a9ce9-c6d3-4b63-a722-cb0adc48863f,dwc:typeStatus,Paratype of Achatina (Pintoa) thermalis,1
271a9ce9-c6d3-4b63-a722-cb0adc48863f,dwc:typeStatus,Paratype of Planorbis ammon,1
271a9ce9-c6d3-4b63-a722-cb0adc48863f,dwc:typeStatus,Cotype of Pinna trigonalis,1
271a9ce9-c6d3-4b63-a722-cb0adc48863f,typestatus,type of alcadia capax,1
271a9ce9-c6d3-4b63-a722-cb0adc48863f,typestatus,paratype of dimyella starcki,2
271a9ce9-c6d3-4b63-a722-cb0adc48863f,dwc:typeStatus,Syntype of Cerithium lacertinum,1
271a9ce9-c6d3-4b63-a722-cb0adc48863f,dwc:typeStatus,Holotype of Clubiona multinotata,1
71b8ffab-444e-43f9-9a9c-5c42b0eaa5eb,dwc:preparations,L M/1 OR M/2; L MOLAR,1
5ab348ab-439a-4697-925c-d6abe0c09b92,dwc:preparations,R DENTARY W I1-M3,3
5ab348ab-439a-4697-925c-d6abe0c09b92,dwc:preparations,/M or P frag,1
71b8ffab-444e-43f9-9a9c-5c42b0eaa5eb,dwc:preparations,"ONE SIDE PELVIS, JUVENILE",1
5ab348ab-439a-4697-925c-d6abe0c09b92,dwc:preparations,L prox. humerus,2
5ab348ab-439a-4697-925c-d6abe0c09b92,dwc:preparations,L LWR MANDIBLE FRAG,1
271a9ce9-c6d3-4b63-a722-cb0adc48863f,dwc:typeStatus,Syntype of Azteca foreli xysticola,1
271a9ce9-c6d3-4b63-a722-cb0adc48863f,dwc:typeStatus,Syntype of Barynotus granulatus,1
7b0809fb-fd62-4733-8f40-74ceb04cbcac,dwc:preparations,Dry - 25; Dry - 1,1
7b0809fb-fd62-4733-8f40-74ceb04cbcac,dwc:preparations,Slide - 1; Slide - 5,1
271a9ce9-c6d3-4b63-a722-cb0adc48863f,dwc:typeStatus,Voucher? of Pecten missouriensis,1
271a9ce9-c6d3-4b63-a722-cb0adc48863f,dwc:typeStatus,Holotype of Cretodromia glaesa,1
271a9ce9-c6d3-4b63-a722-cb0adc48863f,dwc:typeStatus,Lectotype of Cyparium flavipes,1
271a9ce9-c6d3-4b63-a722-cb0adc48863f,dwc:typeStatus,Syntype of Rana subcoerulea,1
271a9ce9-c6d3-4b63-a722-cb0adc48863f,dwc:typeStatus,Holotype of Cyphoneura reducta,1
271a9ce9-c6d3-4b63-a722-cb0adc48863f,dwc:typeStatus,Holotype of Elidiptera regularis,1
271a9ce9-c6d3-4b63-a722-cb0adc48863f,dwc:typeStatus,Holotype of Tryphon peregrinus,1
271a9ce9-c6d3-4b63-a722-cb0adc48863f,dwc:typeStatus,Holotype of Novomessor manni,1
5ab348ab-439a-4697-925c-d6abe0c09b92,dwc:preparations,L dentary with p4,2
271a9ce9-c6d3-4b63-a722-cb0adc48863f,typestatus,paratype of procyon lotor elucus,1
271a9ce9-c6d3-4b63-a722-cb0adc48863f,typestatus,voucher of argonectes longiceps,1
5ab348ab-439a-4697-925c-d6abe0c09b92,dwc:preparations,R scapula (partial),1
71b8ffab-444e-43f9-9a9c-5c42b0eaa5eb,dwc:preparations,NEARLY COMPLETE SKULL,1
271a9ce9-c6d3-4b63-a722-cb0adc48863f,typestatus,holotype of achatinella tricolor,1
271a9ce9-c6d3-4b63-a722-cb0adc48863f,typestatus,holotype of scopoides catharius,1
271a9ce9-c6d3-4b63-a722-cb0adc48863f,dwc:typeStatus,Voucher of Anodontia (Anodontia) edentuloides,3
271a9ce9-c6d3-4b63-a722-cb0adc48863f,typestatus,paratype of drymaeus (triphasicus) vexillum ativagus,1
271a9ce9-c6d3-4b63-a722-cb0adc48863f,dwc:typeStatus,Holotype of Pelegrina kastoni,1
271a9ce9-c6d3-4b63-a722-cb0adc48863f,typestatus,holotype of pelegrina kastoni,1
271a9ce9-c6d3-4b63-a722-cb0adc48863f,dwc:typeStatus,Paratype of Anadara ovalis,1
271a9ce9-c6d3-4b63-a722-cb0adc48863f,typestatus,lectotype of strophia processa,1
271a9ce9-c6d3-4b63-a722-cb0adc48863f,dwc:typeStatus,Paratype of Chondropoma rufopictum moaense,1
271a9ce9-c6d3-4b63-a722-cb0adc48863f,typestatus,paratype of corythalia bryantae,1
271a9ce9-c6d3-4b63-a722-cb0adc48863f,typestatus,voucher of anatina alta| holotype of anatina alta,1
271a9ce9-c6d3-4b63-a722-cb0adc48863f,typestatus,holotype of cesonia notata,1
271a9ce9-c6d3-4b63-a722-cb0adc48863f,dwc:typeStatus,Paratype of Melampus corticinus,1
271a9ce9-c6d3-4b63-a722-cb0adc48863f,dwc:typeStatus,Holotype of Pheidole sagittaria,1
271a9ce9-c6d3-4b63-a722-cb0adc48863f,typestatus,paratype of pseudochromis jamesi,1
71b8ffab-444e-43f9-9a9c-5c42b0eaa5eb,dwc:preparations,"37 L JAWS, 31 R JAWS, 3 MAX, 11 SKULLS",1
5ab348ab-439a-4697-925c-d6abe0c09b92,dwc:preparations,DP4 OR P4,1
81316846-80cb-4913-8941-b31537761eb0,dwc:preparations,Distal tarsometatarsus,1
271a9ce9-c6d3-4b63-a722-cb0adc48863f,dwc:typeStatus,Holotype of Temnothorax liebi,1
71b8ffab-444e-43f9-9a9c-5c42b0eaa5eb,dwc:preparations,"R M/1, L M/1; PALATE, L M3/",1
71b8ffab-444e-43f9-9a9c-5c42b0eaa5eb,dwc:preparations,TOOTH (252),1
5ab348ab-439a-4697-925c-d6abe0c09b92,dwc:preparations,MID PHALANX THIN SECTION,1
271a9ce9-c6d3-4b63-a722-cb0adc48863f,dwc:typeStatus,Voucher of Dinorthis proavita,2
271a9ce9-c6d3-4b63-a722-cb0adc48863f,dwc:typeStatus,Paratype of Urosaurus bicarinatus spinosus,1
271a9ce9-c6d3-4b63-a722-cb0adc48863f,typestatus,paratype of pseudotremia lictor,1
271a9ce9-c6d3-4b63-a722-cb0adc48863f,dwc:typeStatus,Additional Material of Notropis volucellus,1
271a9ce9-c6d3-4b63-a722-cb0adc48863f,typestatus,additional material of notropis volucellus,1
271a9ce9-c6d3-4b63-a722-cb0adc48863f,typestatus,voucher of prolimulus woodwardi| voucher of prolimulus woodwardi,1
271a9ce9-c6d3-4b63-a722-cb0adc48863f,typestatus,holotype of ophiothrix rhabdota,1
271a9ce9-c6d3-4b63-a722-cb0adc48863f,typestatus,syntype of sphaerodactylus glaucus,1
5ab348ab-439a-4697-925c-d6abe0c09b92,dwc:preparations,R bridge peripheral,1
5ab348ab-439a-4697-925c-d6abe0c09b92,dwc:preparations,"PALATE,POSTCRANIAL BONE",1
71b8ffab-444e-43f9-9a9c-5c42b0eaa5eb,dwc:preparations,"SKULL, NECK, PART OF HUMERUS & FOREARM",1
71b8ffab-444e-43f9-9a9c-5c42b0eaa5eb,dwc:preparations,"MAX, R P3/-P4/-M1/-M2/-M3/",1
5ab348ab-439a-4697-925c-d6abe0c09b92,dwc:preparations,R DENTARY W P2-M3+L DENTARY W P4-M3,1
5ab348ab-439a-4697-925c-d6abe0c09b92,dwc:preparations,"R MAXILLA FRAG W M,R M/,/L M3,/R M,TOOTH FRAG",1
5ab348ab-439a-4697-925c-d6abe0c09b92,dwc:preparations,PROPODIAL,1
5ab348ab-439a-4697-925c-d6abe0c09b92,dwc:preparations,partial cuboid,1
71b8ffab-444e-43f9-9a9c-5c42b0eaa5eb,dwc:preparations,"A+B, SMALL 3-D HEAD; EXCELLENT",1
271a9ce9-c6d3-4b63-a722-cb0adc48863f,typestatus,syntype of hyostoma newmanii| paralectotype of hyostoma newmanii,1
271a9ce9-c6d3-4b63-a722-cb0adc48863f,dwc:typeStatus,Holotype of Ceratina disrupta,1
271a9ce9-c6d3-4b63-a722-cb0adc48863f,dwc:typeStatus,Holotype of Andrena percontusa,1
271a9ce9-c6d3-4b63-a722-cb0adc48863f,typestatus,paratype of helix reyrei,1
271a9ce9-c6d3-4b63-a722-cb0adc48863f,dwc:typeStatus,Paratype of Melania leprosa,1
271a9ce9-c6d3-4b63-a722-cb0adc48863f,dwc:typeStatus,Holotype of Theridion weyrauchi,1
271a9ce9-c6d3-4b63-a722-cb0adc48863f,typestatus,holotype of euryurus louisianus,1
271a9ce9-c6d3-4b63-a722-cb0adc48863f,typestatus,holotype of eumastigonus parvus,1
271a9ce9-c6d3-4b63-a722-cb0adc48863f,dwc:typeStatus,Type of Turbinolia corbicula,1
271a9ce9-c6d3-4b63-a722-cb0adc48863f,typestatus,holotype of pareuloma impunctata,1
71b8ffab-444e-43f9-9a9c-5c42b0eaa5eb,dwc:preparations,"SKULL & JAWS, CRUSHED",1
71b8ffab-444e-43f9-9a9c-5c42b0eaa5eb,dwc:preparations,JAW FRAGS EDENTULOUS,1
271a9ce9-c6d3-4b63-a722-cb0adc48863f,typestatus,syntype of chalina finitima,1
71b8ffab-444e-43f9-9a9c-5c42b0eaa5eb,dwc:preparations,AXIS RIB?,1
71b8ffab-444e-43f9-9a9c-5c42b0eaa5eb,dwc:preparations,6 ?DT#/,1
71b8ffab-444e-43f9-9a9c-5c42b0eaa5eb,dwc:preparations,"PARTIAL MAX, R M3/",1
5ab348ab-439a-4697-925c-d6abe0c09b92,dwc:preparations,"MAXILLA FRAGS,TEETH",2
5ab348ab-439a-4697-925c-d6abe0c09b92,dwc:preparations,"INCOMPL L DENTARY,/P4-M1",1
271a9ce9-c6d3-4b63-a722-cb0adc48863f,typestatus,holotype of epinannolene arius,1
271a9ce9-c6d3-4b63-a722-cb0adc48863f,typestatus,holotype of macronotella elegans,1
271a9ce9-c6d3-4b63-a722-cb0adc48863f,dwc:typeStatus,Paratype of Eugerres awlae,1
271a9ce9-c6d3-4b63-a722-cb0adc48863f,dwc:typeStatus,Holotype of Stacheites floweri,1
271a9ce9-c6d3-4b63-a722-cb0adc48863f,dwc:typeStatus,Paratype of Stenoonops padiscus,1
271a9ce9-c6d3-4b63-a722-cb0adc48863f,typestatus,type of xanthandrus guttulata,1
271a9ce9-c6d3-4b63-a722-cb0adc48863f,dwc:typeStatus,Holotype of Sapromyza disjuncta,1
271a9ce9-c6d3-4b63-a722-cb0adc48863f,typestatus,holotype of alsophis angulifer ruttyi,1
271a9ce9-c6d3-4b63-a722-cb0adc48863f,typestatus,paratype of stenamma leptospinum,1
271a9ce9-c6d3-4b63-a722-cb0adc48863f,dwc:typeStatus,Holotype of Parvimolge praecellens,1
271a9ce9-c6d3-4b63-a722-cb0adc48863f,dwc:typeStatus,Holotype of Asthenohymen parvulus,1
271a9ce9-c6d3-4b63-a722-cb0adc48863f,dwc:typeStatus,Syntype of Lygosoma graciloides,1
271a9ce9-c6d3-4b63-a722-cb0adc48863f,typestatus,syntype of urocoptis stricta nataliae,1
271a9ce9-c6d3-4b63-a722-cb0adc48863f,dwc:preparations,whole animal (70% ethanol); tissue (95% ethanol); whole animal (alcohol),1
271a9ce9-c6d3-4b63-a722-cb0adc48863f,dwc:typeStatus,Syntype of Hipponyx cranioides,1
271a9ce9-c6d3-4b63-a722-cb0adc48863f,typestatus,syntype of vertigo tridentata,1
271a9ce9-c6d3-4b63-a722-cb0adc48863f,dwc:typeStatus,Paratype of Pleurotoma pica,1
b7a79601-c07b-46d5-bd09-d4472b0d9431,dwc:typeStatus,"voucher of Equus niobrarensis, page 57 in <a href=\"http://arctos.database.museum/publication/10004547\">Harris and Porter 1980</a>",1
271a9ce9-c6d3-4b63-a722-cb0adc48863f,typestatus,paratype of kinosternon depressum,1
5ab348ab-439a-4697-925c-d6abe0c09b92,dwc:preparations,"4 TEETH,I,P2/,2 M",1
71b8ffab-444e-43f9-9a9c-5c42b0eaa5eb,dwc:preparations,"3 R JAWS, 1 L JAW, R M/1, 2 PARTIAL PALATES",1
5ab348ab-439a-4697-925c-d6abe0c09b92,dwc:preparations,lower m/1 or m/2 frag,1
71b8ffab-444e-43f9-9a9c-5c42b0eaa5eb,dwc:preparations,R MAX WITH 2 T#/ | Cast,1
5ab348ab-439a-4697-925c-d6abe0c09b92,dwc:preparations,/ ANTERIOR TOOTH,1
71b8ffab-444e-43f9-9a9c-5c42b0eaa5eb,dwc:preparations,OLECRANON PROCESS OF L ULNA,1
5ab348ab-439a-4697-925c-d6abe0c09b92,dwc:preparations,left petrosal with stapes,1
71b8ffab-444e-43f9-9a9c-5c42b0eaa5eb,dwc:preparations,R DENTARY: I/1-M/2,1
271a9ce9-c6d3-4b63-a722-cb0adc48863f,dwc:typeStatus,Syntype of Sebastichthys diploproa,1
271a9ce9-c6d3-4b63-a722-cb0adc48863f,dwc:typeStatus,Holotype of Echinolampas intermedius| Voucher of Echinolampas similis,1
7b0809fb-fd62-4733-8f40-74ceb04cbcac,dwc:preparations,Dry - 10; Dry - 11; Dry - 3; Dry - 1,1
271a9ce9-c6d3-4b63-a722-cb0adc48863f,typestatus,syntype of renilla patula,1
271a9ce9-c6d3-4b63-a722-cb0adc48863f,dwc:typeStatus,Type of Siphonella reticulata,1
71b8ffab-444e-43f9-9a9c-5c42b0eaa5eb,dwc:preparations,"5 INCISORS, 30 CANINES, 23 PREMOLARS & MOLARS",1
271a9ce9-c6d3-4b63-a722-cb0adc48863f,typestatus,holotype of poecilochroa inconspicua,1
271a9ce9-c6d3-4b63-a722-cb0adc48863f,typestatus,holotype of lacerta perspicillata pellegrini,1
271a9ce9-c6d3-4b63-a722-cb0adc48863f,typestatus,paratype? of mastophora gasteracanthoides oxalidis,1
271a9ce9-c6d3-4b63-a722-cb0adc48863f,typestatus,paralectotype of parnassius apollo var. kricheldorffi| syntype of parnassius apollo var. kricheldorffi,1
271a9ce9-c6d3-4b63-a722-cb0adc48863f,typestatus,syntype of carcinoplax eburnea,1
271a9ce9-c6d3-4b63-a722-cb0adc48863f,dwc:typeStatus,Holotype of Hexameroceras depressum,2
271a9ce9-c6d3-4b63-a722-cb0adc48863f,typestatus,type of peploglyptus belfragei,1
271a9ce9-c6d3-4b63-a722-cb0adc48863f,dwc:typeStatus,Holotype of Eustala montana,1
271a9ce9-c6d3-4b63-a722-cb0adc48863f,dwc:typeStatus,Syntype of Pheidole goeldii chloe,1
271a9ce9-c6d3-4b63-a722-cb0adc48863f,dwc:typeStatus,Voucher of Valcourea ventro-carinata,1
271a9ce9-c6d3-4b63-a722-cb0adc48863f,dwc:preparations,whole animal (ethanol); stomach content (70% ethanol); Hemipenis (paraffin/ethanol),1
81316846-80cb-4913-8941-b31537761eb0,dwc:preparations,Maxillary/dentary tooth with denticles worn away,1
5ab348ab-439a-4697-925c-d6abe0c09b92,dwc:preparations,"partial r dentary w partial incisor, m1",1
84c24d87-e4ad-4165-8e86-5ae1a249c196,dwc:preparations,flank and head,1
271a9ce9-c6d3-4b63-a722-cb0adc48863f,dwc:typeStatus,Holotype of Bothrops andianus,1
271a9ce9-c6d3-4b63-a722-cb0adc48863f,dwc:typeStatus,Voucher of Evarges branikensis,1
271a9ce9-c6d3-4b63-a722-cb0adc48863f,dwc:typeStatus,Paratype of Eleutherodactylus auriculatus,1
271a9ce9-c6d3-4b63-a722-cb0adc48863f,dwc:typeStatus,Topotype of Phyllomedusa tarsius,1
271a9ce9-c6d3-4b63-a722-cb0adc48863f,dwc:typeStatus,Holotype of Clerus oculatus,1
271a9ce9-c6d3-4b63-a722-cb0adc48863f,typestatus,paratype of eleutherodactylus insignitus,1
271a9ce9-c6d3-4b63-a722-cb0adc48863f,typestatus,paratype of oonops castellus,1
271a9ce9-c6d3-4b63-a722-cb0adc48863f,dwc:typeStatus,Type of Enoclerus pristinus,1
271a9ce9-c6d3-4b63-a722-cb0adc48863f,typestatus,paratype of coenonympha tiphon mackenziei,1
271a9ce9-c6d3-4b63-a722-cb0adc48863f,dwc:typeStatus,Allotype of Eulimnichus subitus,1
271a9ce9-c6d3-4b63-a722-cb0adc48863f,dwc:typeStatus,Voucher of Cephalothrix cf. filiformis,1
71b8ffab-444e-43f9-9a9c-5c42b0eaa5eb,dwc:preparations,"ASSOC L MAXILLA: M1/-M2/-M3/, L DENTARY: M/2-M-3",1
71b8ffab-444e-43f9-9a9c-5c42b0eaa5eb,dwc:preparations,L JAW I/1 P/3 (I/1 BROKEN),1
71b8ffab-444e-43f9-9a9c-5c42b0eaa5eb,dwc:preparations,R DENTARY WITH C/1-P/2-P/2; P/4-M/1-M/2; BROKEN M/3; ALVEOLI FOR I/2-I/3 & P/3,1
71b8ffab-444e-43f9-9a9c-5c42b0eaa5eb,dwc:preparations,1 L M/1; 2 R M/1; R JAW EDENTULOUS,1
71b8ffab-444e-43f9-9a9c-5c42b0eaa5eb,dwc:preparations,"PARTIAL SKULL WITH ALL T#/, ASSOCIATED JAWS",1
271a9ce9-c6d3-4b63-a722-cb0adc48863f,typestatus,paralectotype of lucidella aureola granulosa,1
271a9ce9-c6d3-4b63-a722-cb0adc48863f,typestatus,syntype of pepides sandwicensis,1
271a9ce9-c6d3-4b63-a722-cb0adc48863f,typestatus,paralectotype of scala nitidella,1
271a9ce9-c6d3-4b63-a722-cb0adc48863f,dwc:typeStatus,Paratype of Bulimulus berendti,1
271a9ce9-c6d3-4b63-a722-cb0adc48863f,typestatus,paratype of helicostyla subcarinata archeri,1
271a9ce9-c6d3-4b63-a722-cb0adc48863f,typestatus,type of petalophthalmus pacificus,1
271a9ce9-c6d3-4b63-a722-cb0adc48863f,dwc:typeStatus,Holotype of Cerion alberti,1
271a9ce9-c6d3-4b63-a722-cb0adc48863f,dwc:typeStatus,Holotype of Linyphia latescens,1
271a9ce9-c6d3-4b63-a722-cb0adc48863f,dwc:typeStatus,Lectotype of Pupa hexodon,1
5ab348ab-439a-4697-925c-d6abe0c09b92,dwc:preparations,fragmentary ramus,1
84c24d87-e4ad-4165-8e86-5ae1a249c196,dwc:preparations,cast of mx,3
84c24d87-e4ad-4165-8e86-5ae1a249c196,dwc:preparations,phalanx?,2
271a9ce9-c6d3-4b63-a722-cb0adc48863f,dwc:typeStatus,Holotype of Rhodocrinus uniarticulatus,1
271a9ce9-c6d3-4b63-a722-cb0adc48863f,typestatus,paratype of dinomischus isolatus| voucher of dinomischus isolatus| voucher of dinomischus isolatus| voucher of dinomischus isolatus| voucher of dinomischus isolatus,1
271a9ce9-c6d3-4b63-a722-cb0adc48863f,typestatus,holotype of dactylortyx thoracicus calophonus,1
271a9ce9-c6d3-4b63-a722-cb0adc48863f,dwc:typeStatus,Holotype of Amphelictogon atricolor,1
271a9ce9-c6d3-4b63-a722-cb0adc48863f,typestatus,syntype of solariella equatorialis,1
5ab348ab-439a-4697-925c-d6abe0c09b92,dwc:preparations,"shell frags, juvenile",1
71b8ffab-444e-43f9-9a9c-5c42b0eaa5eb,dwc:preparations,"JAW, L C/#, M/1-M/2 | Cast",1
271a9ce9-c6d3-4b63-a722-cb0adc48863f,dwc:preparations,spread wing (dry); tissue (frozen: vapor phase nitrogen); tissue (frozen: vapor phase nitrogen); tissue (frozen: vapor phase nitrogen); tissue (frozen: vapor phase nitrogen); partial skin (dry); tissue (frozen: vapor phase nitrogen); tissue (frozen: vapor phase nitrogen); tissue (frozen: vapor phase nitrogen); tissue (frozen: vapor phase nitrogen); tissue (frozen: vapor phase nitrogen) sample,1
271a9ce9-c6d3-4b63-a722-cb0adc48863f,typestatus,allotype of pensacola peckhami,1
271a9ce9-c6d3-4b63-a722-cb0adc48863f,typestatus,paratype of bufo perplexus,1
271a9ce9-c6d3-4b63-a722-cb0adc48863f,typestatus,paratype of eleutherodactylus dorsopictus,1
271a9ce9-c6d3-4b63-a722-cb0adc48863f,dwc:typeStatus,Paralectotype of Camponotus ustus depolitus,1
271a9ce9-c6d3-4b63-a722-cb0adc48863f,dwc:typeStatus,Paratype of Protohymen largus,1
d11f19ae-e946-4a0e-83e5-2052ae8cca62,typestatus,n. gen. n. sp. paratype; cited,1
271a9ce9-c6d3-4b63-a722-cb0adc48863f,typestatus,lectotype of cyclostoma ignilabre albilabre,1
271a9ce9-c6d3-4b63-a722-cb0adc48863f,dwc:typeStatus,Lectotype of Strophiops rubiginosa,1
271a9ce9-c6d3-4b63-a722-cb0adc48863f,dwc:typeStatus,Paratype? of Scissurella lyra,1
271a9ce9-c6d3-4b63-a722-cb0adc48863f,typestatus,syntype of helicostyla leucophthalma togolandensis,1
271a9ce9-c6d3-4b63-a722-cb0adc48863f,dwc:typeStatus,Paratype of Strophiops morula,1
271a9ce9-c6d3-4b63-a722-cb0adc48863f,dwc:typeStatus,Holotype of Pseudotremia fulgida,1
